{
    "$schema": "../../../models/schemas/namespaces/sessionManagement.schema.json",
    "description": "Manage settings related to the session of your users.",
    "title": "Session Management",
    "form": {
        "idleSessionTimeout": {
            "hint": "The user will be logged out automatically after the configured time.",
            "label": "Idle Session Timeout",
            "placeholder": "Enter the idle session timeout in minutes"
        },
        "rememberMePeriod": {
            "hint": "The user will be prompted to login again after the configured time.",
            "label": "Remember Me Period",
            "placeholder": "Enter the remember me period in minutes"
        },
        "enableMaximumSessionTimeout": {
            "hint": "Enable a maximum session lifetime for the user sessions.",
            "label": "Enable Maximum Session Timeout"
        },
        "maximumSessionTimeout": {
            "hint": "The user will be required to re-authenticate after the configured time, regardless of activity.",
            "label": "Maximum Session Timeout",
            "placeholder": "Enter the maximum session timeout in minutes"
        },
        "preserveCurrentSessionAtPasswordUpdate": {
            "hint": "If enabled, the current session and token will NOT be terminated or revoked when the user updates their password.",
            "label": "Skip terminating current session and token on password update"
        },
        "validation": {
            "idleSessionTimeout": "Idle Session Timeout should be a positive integer.",
            "rememberMePeriod": "Remember Me Period should be a positive integer.",
            "maximumSessionTimeout": "Maximum Session Timeout should be a positive integer."
        }
    },
    "notifications": {
        "getConfiguration": {
            "error": {
                "description": "Error occurred while fetching session management settings.",
                "message": "Error occurred"
            }
        },
        "revertConfiguration": {
            "error": {
                "message": "Error occurred",
                "description": "Error occurred while reverting session management settings."
            },
            "success": {
                "message": "Revert successful",
                "description": "Successfully reverted the session management settings."
            }
        },
        "updateConfiguration": {
            "error": {
                "description": "Error occurred while updating session management settings.",
                "message": "Error occurred"
            },
            "success": {
                "description": "Successfully updated the session management settings.",
                "message": "Update successful"
            }
        }
    }
}
